id,submitted,updated,title,abstract,authors,affiliations,link_abstract,link_pdf,link_doi,comment,journal_ref,doi,primary_category,categories,pdf_url
2110.10680v1,2021-10-20T17:49:40Z,2021-10-20 17:49:40,"A Critique of a Variety of ""Memory-Based'' Process Monitoring Methods","Many extensions and modifications have been made to standard process monitoring methods such as the exponentially weighted moving average (EWMA) chart and the cumulative sum (CUSUM) chart. In addition, new schemes have been proposed based on alternative weighting of past data, usually to put greater emphasis on past data and less weight on current and recent data. In other cases, the output of one process monitoring method, such as the EWMA statistic, is used as the input to another method, such as the CUSUM chart. Often the recursive formula for a control chart statistic is itself used recursively to form a new control chart statistic. We find the use of these ad hoc methods to be unjustified. Statistical performance comparisons justifying the use of these methods have been either flawed by focusing only on zero-state run length metrics or by making comparisons to an unnecessarily weak competitor.",Sven Knoth|Nesma A. Saleh|Mahmoud A. Mahmoud|William H. Woodall|Victor G. Tercero-Gomez,,https://arxiv.org/abs/2110.10680v1,https://arxiv.org/pdf/2110.10680v1,,"31 pages, 26 figures, 10 tables",,,stat.ME,stat.ME,https://arxiv.org/pdf/2110.10680v1.pdf
2109.00952v1,2021-09-02T13:53:22Z,2021-09-02 13:53:22,Fault detection and diagnosis of batch process using dynamic ARMA-based control charts,"A wide range of approaches for batch processes monitoring can be found in the literature. This kind of process generates a very peculiar data structure, in which successive measurements of many process variables in each batch run are available. Traditional approaches do not take into account the time series nature of the data. The main reason is that the time series inference theory is not based on replications of time series, as it is in batch process data. It is based on the variability in a time domain. This fact demands some adaptations of this theory in order to accommodate the model coefficient estimates, considering jointly the batch to batch samples variability (batch domain) and the serial correlation in each batch (time domain). In order to address this issue, this paper proposes a new approach grounded in a group of control charts based on the classical ARMA model for monitoring and diagnostic of batch processes dynamics. The model coefficients are estimated (through the ordinary least square method) for each historical time series sample batch and modified Hotelling and t-Student distributions are derived and used to accommodate those estimates. A group of control charts based on that distributions are proposed for monitoring the new batches. Additionally, those groups of charts help to fault diagnosis, identifying the source of disturbances. Through simulated and real data we show that this approach seems to work well for both purposes.",Batista Nunes de Oliveira|Marcio Valk|Danilo Marcondes Filho,,https://arxiv.org/abs/2109.00952v1,https://arxiv.org/pdf/2109.00952v1,,,,,stat.ME,stat.ME,https://arxiv.org/pdf/2109.00952v1.pdf
2108.05239v1,2021-08-11T14:15:59Z,2021-08-11 14:15:59,The Effect of Autocorrelation on the Shewhart-RZ Control Chart,"In many industrial manufacturing processes, the quality of products depends on the relation between two main ingredients or characteristics. Often, this calls for monitoring the ratio of two normal random variables with statistical process control (SPC) techniques. A large number of studies related to designing control charts monitoring this ratio have been published. However, these studies are based purely on the assumption of independent observations. In practice, autocorrelation between observations can exist and should be modeled to protect against the false alarm rate inflation when implementing a control chart. In this paper, we tackle this problem by investigating the performance of the Shewhart control chart monitoring the ratio of two normal variables, (denoted as Shewhart-RZ), in the presence of autocorrelation between successive observations. The autocorrelation is modeled through the bivariate autoregressive model VAR(1). We also provide an example to illustrates the use of the Shewhart-RZ control chart on a quality control problem.",H. D. Nguyen|A. Ahmadi Nadi|K. P. Tran|P. Castagliola|G. Celano|K. D. Tran,,https://arxiv.org/abs/2108.05239v1,https://arxiv.org/pdf/2108.05239v1,,,,,stat.AP,stat.AP,https://arxiv.org/pdf/2108.05239v1.pdf
2107.13394v1,2021-07-14T18:01:46Z,2021-07-14 18:01:46,Nonlinear State Space Modeling and Control of the Impact of Patients' Modifiable Lifestyle Behaviors on the Emergence of Multiple Chronic Conditions,"The emergence and progression of multiple chronic conditions (MCC) over time often form a dynamic network that depends on patient's modifiable risk factors and their interaction with non-modifiable risk factors and existing conditions. Continuous time Bayesian networks (CTBNs) are effective methods for modeling the complex network of MCC relationships over time. However, CTBNs are not able to effectively formulate the dynamic impact of patient's modifiable risk factors on the emergence and progression of MCC. Considering a functional CTBN (FCTBN) to represent the underlying structure of the MCC relationships with respect to individuals' risk factors and existing conditions, we propose a nonlinear state-space model based on Extended Kalman filter (EKF) to capture the dynamics of the patients' modifiable risk factors and existing conditions on the MCC evolution over time. We also develop a tensor control chart to dynamically monitor the effect of changes in the modifiable risk factors of individual patients on the risk of new chronic conditions emergence. We validate the proposed approach based on a combination of simulation and real data from a dataset of 385 patients from Cameron County Hispanic Cohort (CCHC) over multiple years. The dataset examines the emergence of 5 chronic conditions (Diabetes, Obesity, Cognitive Impairment, Hyperlipidemia, and Hypertension) based on 4 modifiable risk factors representing lifestyle behaviors (Diet, Exercise, Smoking Habit, and Drinking Habit) and 3 non-modifiable risk factors, including demographic information (Age, Gender, Education). The results demonstrate the effectiveness of the proposed methodology for dynamic prediction and monitoring of the risk of MCC emergence in individual patients.",Syed Hasib Akhter Faruqui|Adel Alaeddini|Jing Wang|Susan P Fisher-Hoch|Joseph B Mccormic,,https://arxiv.org/abs/2107.13394v1,https://arxiv.org/pdf/2107.13394v1,,Submitted to IEEE Access for review,,,stat.ME,stat.ME|cs.LG|eess.SY|stat.AP,https://arxiv.org/pdf/2107.13394v1.pdf
2107.00224v1,2021-07-01T05:42:44Z,2021-07-01 05:42:44,The Case against Generally Weighted Moving Average (GWMA) Control Charts,"We argue against the use of generally weighted moving average (GWMA) control charts. Our primary reasons are the following: 1) There is no recursive formula for the GWMA control chart statistic, so all previous data must be stored and used in the calculation of each chart statistic. 2) The Markovian property does not apply to the GWMA statistics, so computer simulation must be used to determine control limits and the statistical performance. 3) An appropriately designed, and much simpler, exponentially weighted moving average (EWMA) chart provides as good or better statistical performance. 4) In some cases the GWMA chart gives more weight to past data values than to current values.",Sven Knoth|William H. Woodall|Víctor G. Tercero-Gómez,,https://arxiv.org/abs/2107.00224v1,https://arxiv.org/pdf/2107.00224v1,https://doi.org/10.1080/08982112.2021.2002359,"8 pages, 8 figures, 2 tables",,10.1080/08982112.2021.2002359,stat.ME,stat.ME,https://arxiv.org/pdf/2107.00224v1.pdf
2102.00375v1,2021-01-31T04:29:56Z,2021-01-31 04:29:56,Real-time Monitoring of Autonomous Vehicle's Time Gap Variations: A Bayesian Framework,"This paper proposes a novel monitoring methodology for car-following control of automated vehicles that uses real-time measurements of spacing and velocity obtained through vehicle sensors. This study focuses on monitoring the time gap, a key parameter that dictates the desired following spacing of the controlled vehicle. The goal is to monitor deviations in actual time gap from a desired setting and detect when it deviates beyond a control limit. A random coefficient modeling is developed to systematically capture the stochastic distribution of the time gap and derive a closed-form Bayesian updating scheme for real-time inference. A control chart is then adopted to systematically set the control limits and inform when the time gap setting should be changed. Simulation experiments are performed to demonstrate the effectiveness of the proposes method for monitoring the time gap and alerting when the parameter setting needs to be changed.",Wissam Kontar|Soyoung Ahn,,https://arxiv.org/abs/2102.00375v1,https://arxiv.org/pdf/2102.00375v1,,"This paper was accepted to the 99th Annual Meeting of the Transportation Research Board, Washington, D.C., United States, 2020",,,eess.SY,eess.SY,https://arxiv.org/pdf/2102.00375v1.pdf
2101.11711v1,2021-01-25T21:56:33Z,2021-01-25 21:56:33,Damage detection in operational wind turbine blades using a new approach based on machine learning,"The application of reliable structural health monitoring (SHM) technologies to operational wind turbine blades is a challenging task, due to the uncertain nature of the environments they operate in. In this paper, a novel SHM methodology, which uses Gaussian Processes (GPs) is proposed. The methodology takes advantage of the fact that the blades on a turbine are nominally identical in structural properties and encounter the same environmental and operational variables (EOVs). The properties of interest are the first edgewise frequencies of the blades. The GPs are used to predict the edge frequencies of one blade given that of another, after these relationships between the pairs of blades have been learned when the blades are in a healthy state. In using this approach, the proposed SHM methodology is able to identify when the blades start behaving differently from one another over time. To validate the concept, the proposed SHM system is applied to real onshore wind turbine blade data, where some form of damage was known to have taken place. X-bar control chart analysis of the residual errors between the GP predictions and actual frequencies show that the system successfully identified early onset of damage as early as six months before it was identified and remedied.",Kartik Chandrasekhar|Nevena Stevanovic|Elizabeth J. Cross|Nikolaos Dervilis|Keith Worden,,https://arxiv.org/abs/2101.11711v1,https://arxiv.org/pdf/2101.11711v1,https://doi.org/10.1016/j.renene.2020.12.119,,"This is an author produced version of a paper subsequently published in Renewable Energy, Elsevier, 2021. Uploaded in accordance with the publisher's self-archiving policy",10.1016/j.renene.2020.12.119,cs.LG,cs.LG|physics.data-an,https://arxiv.org/pdf/2101.11711v1.pdf
2101.09424v1,2021-01-23T05:38:17Z,2021-01-23 05:38:17,A Change-Point Based Control Chart for Detecting Sparse Changes in High-Dimensional Heteroscedastic Data,"Because of the curse-of-dimensionality, high-dimensional processes present challenges to traditional multivariate statistical process monitoring (SPM) techniques. In addition, the unknown underlying distribution and complicated dependency among variables such as heteroscedasticity increase uncertainty of estimated parameters, and decrease the effectiveness of control charts. In addition, the requirement of sufficient reference samples limits the application of traditional charts in high dimension low sample size scenarios (small n, large p). More difficulties appear in detecting and diagnosing abnormal behaviors that are caused by a small set of variables, i.e., sparse changes. In this article, we propose a changepoint based control chart to detect sparse shifts in the mean vector of high-dimensional heteroscedastic processes. Our proposed method can start monitoring when the number of observations is a lot smaller than the dimensionality. The simulation results show its robustness to nonnormality and heteroscedasticity. A real data example is used to illustrate the effectiveness of the proposed control chart in high-dimensional applications. Supplementary material and code are provided online.",Zezhong Wang|Inez Maria Zwetsloot,,https://arxiv.org/abs/2101.09424v1,https://arxiv.org/pdf/2101.09424v1,,,,,stat.ME,stat.ME,https://arxiv.org/pdf/2101.09424v1.pdf
2101.07575v2,2021-01-19T11:47:51Z,2021-01-22 04:41:52,A note on the g and h control charts,"In this note, we revisit the $g$ and $h$ control charts that are commonly used for monitoring the number of conforming cases between the two consecutive appearances of nonconformities. It is known that the process parameter of these charts is usually unknown and estimated by using the maximum likelihood estimator and the minimum variance unbiased estimator. However, the minimum variance unbiased estimator in the control charts has been inappropriately used in the quality engineering literature. This observation motivates us to provide the correct minimum variance unbiased estimator and investigate theoretical and empirical biases of these estimators under consideration. Given that these charts are developed based on the underlying assumption that samples from the process should be balanced, which is often not satisfied in many practical applications, we propose a method for constructing these charts with unbalanced samples.",Chanseok Park|Min Wang,,https://arxiv.org/abs/2101.07575v2,https://arxiv.org/pdf/2101.07575v2,,"17 pages, 1 figure, 2 tables",,,stat.AP,stat.AP,https://arxiv.org/pdf/2101.07575v2.pdf
2101.04011v1,2021-01-11T16:36:37Z,2021-01-11 16:36:37,Controlling the EWMA $S^2$ control chart false alarm behavior when the in-control variance level must be estimated,"Investigating the problem of setting control limits in the case of parameter uncertainty is more accessible when monitoring the variance because only one parameter has to be estimated. Simply ignoring the induced uncertainty frequently leads to control charts with poor false alarm performances. Adjusting the unconditional in-control (IC) average run length (ARL) makes the situation even worse. Guaranteeing a minimum conditional IC ARL with some given probability is another very popular approach to solving these difficulties. However, it is very conservative as well as more complex and more difficult to communicate. We utilize the probability of a false alarm within the planned number of points to be plotted on the control chart. It turns out that adjusting this probability produces notably different limit adjustments compared to controlling the unconditional IC ARL. We then develop numerical algorithms to determine the respective modifications of the upper and two-sided exponentially weighted moving average (EWMA) charts based on the sample variance for normally distributed data. These algorithms are made available within an R package. Finally, the impacts of the EWMA smoothing constant and the size of the preliminary sample on the control chart design and its performance are studied.",Sven Knoth,,https://arxiv.org/abs/2101.04011v1,https://arxiv.org/pdf/2101.04011v1,https://doi.org/10.1002/asmb.2613,,,10.1002/asmb.2613,stat.ME,stat.ME,https://arxiv.org/pdf/2101.04011v1.pdf
2012.14759v5,2020-12-29T14:15:20Z,2024-01-24 06:46:48,Dependence control chart using maximum copula entropy,"Statistical quality control methods are noteworthy to producing standard production in manufacturing processes. In this regard, there are many classical manners to control the process. Many of them have a global assumption around the distributions of the process data. They are supposed to be Normal, but it is clear that it is not always valid for all processes. Such control charts made some wrong decisions that waste funds. So, the main question while working with multivariate data set is how to find the multivariate distribution of the data set, which saves the original dependency between variables. To our knowledge, a copula function guarantees dependence on the result function. It is not enough when there is no other fundamental information about the statistical society, and we have just a data set. Therefore, we apply the maximum entropy concept to deal with this situation. In this paper, first of all, we get the joint distribution of a data set from a manufacturing process that needs to be in-control while running the production process. Then, we get an elliptical control limit via the maximum copula entropy. Finally, we represent a practical example using the method. Average run lengths are calculated for some means and shifts to show the ability of the maximum copula entropy. In the end, two practical data examples are presented, and the results of our method are compared with the traditional way based on Fisher distribution.",Seyedeh Azadeh Fallah Mortezanejad|Ruochen Wang|Gholamreza Mohtashami Borzadaran|Kim Phuc Tran,,https://arxiv.org/abs/2012.14759v5,https://arxiv.org/pdf/2012.14759v5,,,,,stat.AP,stat.AP,https://arxiv.org/pdf/2012.14759v5.pdf
2012.14289v4,2020-12-28T15:34:05Z,2023-11-01 02:31:37,Profile control chart based on maximum entropy,"Monitoring a process over time is so important in manufacturing processes to reduce the waste of money and time. Some charts as Shewhart, CUSUM, and EWMA are common to monitor a process with a single intended attribute which is used in different kinds of processes with various ranges of shifts. In some cases, the process quality is characterized by different types of profiles. The purpose of this article is to monitor profile coefficients instead of a process mean. In this paper, two methods are proposed for monitoring the intercept and slope of the simple linear profile, simultaneously. In this regard, two methods are compared here. The first one is the linear regression, and the one is the maximum entropy principle. The T2 Hotelling statistics is used to transfer two coefficients to a scalar. A simulation study is applied to compare the two methods in terms of the second type of error and average run length. Finally, two real examples are presented to demonstrate the applicability of the proposed chart. The first one is about semiconductors, and the second one is about pharmaceutical production processes. The performance of the methods is relatively similar. The maximum entropy plays an important role in correctly identifying differences in the pharmaceutical example, while linear regression did not correctly detect these changes.",Seyedeh Azadeh Fallah Mortezanejad|Ruochen Wang|Gholamreza Mohtashami Borzadaran|Renkai Ding|Kim Phuc Tran,,https://arxiv.org/abs/2012.14289v4,https://arxiv.org/pdf/2012.14289v4,,,,,stat.AP,stat.AP,https://arxiv.org/pdf/2012.14289v4.pdf
2011.06080v1,2020-11-10T17:15:53Z,2020-11-10 17:15:53,Statistical learning for change point and anomaly detection in graphs,"Complex systems which can be represented in the form of static and dynamic graphs arise in different fields, e.g. communication, engineering and industry. One of the interesting problems in analysing dynamic network structures is to monitor changes in their development. Statistical learning, which encompasses both methods based on artificial intelligence and traditional statistics, can be used to progress in this research area. However, the majority of approaches apply only one or the other framework. In this paper, we discuss the possibility of bringing together both disciplines in order to create enhanced network monitoring procedures focussing on the example of combining statistical process control and deep learning algorithms. Together with the presentation of change point and anomaly detection in network data, we propose to monitor the response times of ambulance services, applying jointly the control chart for quantile function values and a graph convolutional network.",Anna Malinovskaya|Philipp Otto|Torben Peters,,https://arxiv.org/abs/2011.06080v1,https://arxiv.org/pdf/2011.06080v1,,,,,cs.LG,cs.LG|stat.ME,https://arxiv.org/pdf/2011.06080v1.pdf
2010.11826v1,2020-10-22T16:03:58Z,2020-10-22 16:03:58,Nonparametric robust monitoring of time series panel data,"In many applications, a control procedure is required to detect potential deviations in a panel of serially correlated processes. It is common that the processes are corrupted by noise and that no prior information about the in-control data are available for that purpose. This paper suggests a general nonparametric monitoring scheme for supervising such a panel with time-varying mean and variance. The method is based on a control chart designed by block bootstrap, which does not require parametric assumptions on the distribution of the data. The procedure is tailored to cope with strong noise, potentially missing values and absence of in-control series, which is tackled by an intelligent exploitation of the information in the panel. Our methodology is completed by support vector machine procedures to estimate magnitude and form of the encountered deviations (such as stepwise shifts or functional drifts). This scheme, though generic in nature, is able to treat an important applied data problem: the control of deviations in a subset of sunspot number observations which are part of the International Sunspot Number, a world reference for long-term solar activity.",Sophie Mathieu|Rainer von Sachs|Véronique Delouille|Laure Lefèvre|Christian Ritter,,https://arxiv.org/abs/2010.11826v1,https://arxiv.org/pdf/2010.11826v1,,"58 pages, 18 figures",,,stat.AP,stat.AP|stat.ME,https://arxiv.org/pdf/2010.11826v1.pdf
2010.09398v2,2020-10-19T11:36:24Z,2021-05-14 15:39:17,Online network monitoring,"The application of network analysis has found great success in a wide variety of disciplines; however, the popularity of these approaches has revealed the difficulty in handling networks whose complexity scales rapidly. One of the main interests in network analysis is the online detection of anomalous behaviour. To overcome the curse of dimensionality, we introduce a network surveillance method bringing together network modelling and statistical process control. Our approach is to apply multivariate control charts based on exponential smoothing and cumulative sums in order to monitor networks determined by temporal exponential random graph models (TERGM). This allows us to account for temporal dependence, while simultaneously reducing the number of parameters to be monitored. The performance of the proposed charts is evaluated by calculating the average run length for both simulated and real data. To prove the appropriateness of the TERGM to describe network data, some measures of goodness of fit are inspected. We demonstrate the effectiveness of the proposed approach by an empirical application, monitoring daily flights in the United States to detect anomalous patterns.",Anna Malinovskaya|Philipp Otto,,https://arxiv.org/abs/2010.09398v2,https://arxiv.org/pdf/2010.09398v2,https://doi.org/10.1007/s10260-021-00589-z,,Statistical Methods & Applications 2021,10.1007/s10260-021-00589-z,stat.ME,stat.ME,https://arxiv.org/pdf/2010.09398v2.pdf
2010.09099v1,2020-10-18T20:45:14Z,2020-10-18 20:45:14,Decentralized and Secure Generation Maintenance with Differential Privacy,"Decentralized methods are gaining popularity for data-driven models in power systems as they offer significant computational scalability while guaranteeing full data ownership by utility stakeholders. However, decentralized methods still require sharing information about network flow estimates over public facing communication channels, which raises privacy concerns. In this paper we propose a differential privacy driven approach geared towards decentralized formulations of mixed integer operations and maintenance optimization problems that protects network flow estimates. We prove strong privacy guarantees by leveraging the linear relationship between the phase angles and the flow. To address the challenges associated with the mixed integer and dynamic nature of the problem, we introduce an exponential moving average based consensus mechanism to enhance convergence, coupled with a control chart based convergence criteria to improve stability. Our experimental results obtained on the IEEE 118 bus case demonstrate that our privacy preserving approach yields solution qualities on par with benchmark methods without differential privacy. To demonstrate the computational robustness of our method, we conduct experiments using a wide range of noise levels and operational scenarios.",Paritosh Ramanan|Murat Yildirim|Nagi Gebraeel|Edmond Chow,,https://arxiv.org/abs/2010.09099v1,https://arxiv.org/pdf/2010.09099v1,,,,,cs.DC,cs.DC|cs.CR|math.OC,https://arxiv.org/pdf/2010.09099v1.pdf
