id,submitted,updated,title,abstract,authors,affiliations,link_abstract,link_pdf,link_doi,comment,journal_ref,doi,primary_category,categories,pdf_url
1907.05453v2,2019-07-11T19:12:24Z,2019-11-07 13:52:06,Model based Level Shift Detection in Autocorrelated Data Streams using a moving window,"Standard Control Chart techniques to detect level shift in data streams assume independence between observations. As data today is collected with high frequency, this assumption is seldom valid. To overcome this, we propose to adapt the off-line test procedure for detection of outliers based on one-step prediction errors proposed by Tsay (1988) into an on-line framework by considering a moving window. Further, we present two algorithms, that in combination, estimate an appropriate test value for our control chart. We test our method on AR(1) processes exposed to level shifts of different sizes and compare it to CUSUM applied to one-step prediction errors. We find that, even though both methods perform comparable when tuned correctly, our method has higher probability of identifying the correct change point of the process. Furthermore, for more complicated processes our method is easier to tune, as the range of window size to be tested is independent of the process.",Jacob Søgaard Larsen|Anders Stockmarr|Bjarne Kjær Ersbøll|Murat Kulahci,,https://arxiv.org/abs/1907.05453v2,https://arxiv.org/pdf/1907.05453v2,,"14 pages, 8 figures and 1 table",,,stat.ME,stat.ME|stat.OT,https://arxiv.org/pdf/1907.05453v2.pdf
1907.00111v3,2019-06-28T22:53:28Z,2020-07-10 05:11:01,An Intrinsic Geometrical Approach for Statistical Process Control of Surface and Manifold Data,"We present a new method for statistical process control (SPC) of a discrete part manufacturing system based on intrinsic geometrical properties of the parts, estimated from three-dimensional sensor data. An intrinsic method has the computational advantage of avoiding the difficult part registration problem, necessary in previous SPC approaches of three-dimensional geometrical data, but inadequate if noncontact sensors are used. The approach estimates the spectrum of the Laplace-Beltrami (LB) operator of the scanned parts and uses a multivariate nonparametric control chart for online process control. Our proposal brings SPC closer to computer vision and computer graphics methods aimed to detect large differences in shape (but not in size). However, the SPC problem differs in that small changes in either shape or size of the parts need to be detected, keeping a controllable false alarm rate and without completely filtering noise. An online or ""Phase II"" method and a scheme for starting up in the absence of prior data (""Phase I"") are presented. Comparison with earlier approaches that require registration shows the LB spectrum method to be more sensitive to rapidly detect small changes in shape and size, including the practical case when the sequence of part datasets is in the form of large, unequal size meshes. A post-alarm diagnostic method to investigate the location of defects on the surface of a part is also presented. While we focus in this article on surface (triangulation) data, the methods can also be applied to point cloud and voxel metrology data.",Xueqi Zhao|Enrique del Castillo,,https://arxiv.org/abs/1907.00111v3,https://arxiv.org/pdf/1907.00111v3,https://doi.org/10.1080/00401706.2020.1772114,,,10.1080/00401706.2020.1772114,stat.AP,stat.AP,https://arxiv.org/pdf/1907.00111v3.pdf
1906.08038v1,2019-06-19T12:14:33Z,2019-06-19 12:14:33,Should Observations be Grouped for Effective Monitoring of Multivariate Process Variability?,"A multivariate dispersion control chart monitors changes in the process variability of multiple correlated quality characteristics. In this article, we investigate and compare the performance of charts designed to monitor variability based on individual and grouped multivariate observations. We compare one of the most well-known methods for monitoring individual observations -- a multivariate EWMA chart proposed by Huwang et al -- to various charts based on grouped observations. In addition, we compare charts based on monitoring with overlapping and nonoverlapping subgroups. We recommend using charts based on overlapping subgroups when monitoring with subgroup data. The effect of subgroup size is also investigated. Steady-state average time to signal is used as performance measure. We show that monitoring methods based on individual observations are the quickest in detecting sustained shifts in the process variability. We use a simulation study to obtain our results and illustrated these with a case study.",Jimoh Olawale Ajadi|Inez Maria Zwetsloot,,https://arxiv.org/abs/1906.08038v1,https://arxiv.org/pdf/1906.08038v1,,,,,stat.ME,stat.ME,https://arxiv.org/pdf/1906.08038v1.pdf
1903.06675v1,2019-02-14T13:01:06Z,2019-02-14 13:01:06,Markov Chain-based Cost-Optimal Control Charts for Healthcare Data,"Control charts have traditionally been used in industrial statistics, but are constantly seeing new areas of application, especially in the age of Industry 4.0. This paper introduces a new method, which is suitable for applications in the healthcare sector, especially for monitoring a health-characteristic of a patient. We adapt a Markov chain-based approach and develop a method in which not only the shift size (i.e. the degradation of the patient's health) can be random, but the effect of the repair (i.e. treatment) and time between samplings (i.e. visits) too. This means that we do not use many often-present assumptions which are usually not applicable for medical treatments. The average cost of the protocol, which is determined by the time between samplings and the control limit, can be estimated using the stationary distribution of the Markov chain.
  Furthermore, we incorporate the standard deviation of the cost into the optimisation procedure, which is often very important from a process control viewpoint. The sensitivity of the optimal parameters and the resulting average cost and cost standard deviation on different parameter values is investigated. We demonstrate the usefulness of the approach for real-life data of patients treated in Hungary: namely the monitoring of cholesterol level of patients with cardiovascular event risk. The results showed that the optimal parameters from our approach can be somewhat different from the original medical parameters.",Balázs Dobi|András Zempléni,,https://arxiv.org/abs/1903.06675v1,https://arxiv.org/pdf/1903.06675v1,,,,,stat.AP,stat.AP|cs.CY|stat.ME|stat.ML,https://arxiv.org/pdf/1903.06675v1.pdf
1902.02270v1,2019-02-06T16:53:17Z,2019-02-06 16:53:17,Using statistical control charts to monitor duration-based performance of project,"Monitoring of project performance is a crucial task of project managers that significantly affect the project success or failure. Earned Value Management (EVM) is a well-known tool to evaluate project performance and effective technique for identifying delays and proposing appropriate corrective actions. The original EVM analysis is a monetary-based method and it can be misleading in the evaluation of the project schedule performance and estimation of the project duration. Earned Duration Management (EDM) is a more recent method which introduces metrics for the project schedule performance evaluation and improves EVM analysis. In this paper, we apply statistical control charts on EDM indices to better investigate the variations of project schedule performance. Control charts are decision support tools to detect the out of control performance. Usually project performance measurements are auto-correlated and not following the normal distribution. Hence, in this paper, a two-step adjustment framework is proposed to make the control charts applicable to non-normal and auto-correlated measurements. The case study project illustrates how the new method can be implemented in practice. The numerical results conclude that that employing control chart method along with analyzing the actual values of EDM indices increase the capability of project management teams to detect cost and schedule problems on time",Nooshin Yousefi|Ahmad Sobhani|Leila Moslemi Naeni|Kenneth R. Currie,,https://arxiv.org/abs/1902.02270v1,https://arxiv.org/pdf/1902.02270v1,https://doi.org/10.19255/jmpm415,,,10.19255/jmpm415,stat.AP,stat.AP,https://arxiv.org/pdf/1902.02270v1.pdf
1901.03701v1,2019-01-11T10:50:51Z,2019-01-11 10:50:51,Robust Adaptive Control Charts,"In statistical process control, procedures are applied that require relatively strict conditions for their use. If such assumptions are violated, these methods become inefficient, leading to increased incidence of false signals. Therefore, a robust version of control charts is sought to be less sensitive with respect to a breach of normality and independence in measurements. Robust control charts, however, usually increase the delay in the detection of assignable causes. This negative effect can, to some extent, be removed with the aid of an adaptive approach.",Gejza Dohnal,,https://arxiv.org/abs/1901.03701v1,https://arxiv.org/pdf/1901.03701v1,,"8 pages, 3 figures. The paper was presented as a contribution on Quality and Productivity Research Conference, Long Beach, CA, June 4 - 7 2012",,,stat.OT,stat.OT,https://arxiv.org/pdf/1901.03701v1.pdf
1812.11132v1,2018-12-24T21:01:36Z,2018-12-24 21:01:36,Application of Robust Estimators in Shewhart S-Charts,"Maintaining the quality of manufactured products at a desired level is known to increase customer satisfaction and profitability. Shewhart control chart is the most widely used in statistical process control (SPC) technique to monitor the quality of products and control process variability. Based on the assumption of independent and normally distributed data sets, sample mean and standard deviation statistics are known to be the most efficient conventional estimators to determine the process location and scale, respectively. On the other hand, there is not guarantee that the real-world process data would be normally distributed: outliers may exist, and/or sampled population may be contaminated. In such cases, efficiency of the conventional estimators is significantly reduced, and power of the Shewhart charts may be undesirably low, e.g. occasional outliers in the rational subgroups (Phase I dataset) may drastically affect the sample mean and standard deviation, resulting a serious delay in detection of inferior products (Phase II procedure). For more efficient analyses, it is required to use robust estimators against contaminations. Consequently, it is determined that robust estimators are more efficient both against diffuse localized and symmetric-asymmetric contaminations, and have higher power in detecting disturbances, compared to conventional methods.",Burak Alakent|Ece C. Mutlu,,https://arxiv.org/abs/1812.11132v1,https://arxiv.org/pdf/1812.11132v1,,,,,stat.OT,stat.OT,https://arxiv.org/pdf/1812.11132v1.pdf
1809.03127v2,2018-09-10T04:28:42Z,2019-06-11 08:14:43,Monitoring data quality for telehealth systems in the presence of missing data,"Background: All-in-one station-based health monitoring devices are implemented in elder homes in Hong Kong to support the monitoring of vital signs of the elderly. During a pilot study, it was discovered that the systolic blood pressure was incorrectly measured during multiple weeks. A real-time solution was needed to identify future data quality issues as soon as possible.
  Methods: Control charts are an effective tool for real-time monitoring and signaling issues (changes) in data. In this study, as in other healthcare applications, many observations are missing. Few methods are available for monitoring data with missing observations. A data quality monitoring method is developed to signal issues with the accuracy of the collected data quickly. This method has the ability to deal with missing observations. A Hotelling's T-squared control chart is selected as the basis for our proposed method.
  Findings: The proposed method is retrospectively validated on a case study with a known measurement error in the systolic blood pressure measurements. The method is able to adequately detect this data quality problem. The proposed method was integrated into a personalized telehealth monitoring system and prospectively implemented in a second case study. It was found that the proposed scheme supports the control of data quality.
  Conclusions: Data quality is an important issue and control charts are useful for real-time monitoring of data quality. However, these charts must be adjusted to account for missing data that often occur in healthcare context.",Tahir Mahmood|Philipp Wittenberg|Inez Maria Zwetsloot|Hailiang Wang|Kwok Leung Tsui,,https://arxiv.org/abs/1809.03127v2,https://arxiv.org/pdf/1809.03127v2,https://doi.org/10.1016/j.ijmedinf.2019.03.011,"13 pages, 5 figures",Int. J. Med. Inform. 126 (2019) 156-163,10.1016/j.ijmedinf.2019.03.011,stat.AP,stat.AP|stat.ME,https://arxiv.org/pdf/1809.03127v2.pdf
1808.05069v1,2018-08-15T13:30:54Z,2018-08-15 13:30:54,The Steady-State Behavior of Multivariate Exponentially Weighted Moving Average Control Charts,"Multivariate Exponentially Weighted Moving Average, MEWMA, charts are popular, handy and effective procedures to detect distributional changes in a stream of multivariate data. For doing appropriate performance analysis, dealing with the steady-state behavior of the MEWMA statistic is essential. Going beyond early papers, we derive quite accurate approximations of the respective steady-state densities of the MEWMA statistic. It turns out that these densities could be rewritten as the product of two functions depending on one argument only which allows feasible calculation. For proving the related statements, the presentation of the non-central chisquare density deploying the confluent hypergeometric limit function is applied. Using the new methods it was found that for large dimensions, the steady-state behavior becomes different to what one might expect from the univariate monitoring field. Based on the integral equation driven methods, steady-state and worst-case average run lengths are calculated with higher accuracy than before. Eventually, optimal MEWMA smoothing constants are derived for all considered measures.",Sven Knoth,,https://arxiv.org/abs/1808.05069v1,https://arxiv.org/pdf/1808.05069v1,https://doi.org/10.1080/07474946.2018.1554890,,,10.1080/07474946.2018.1554890,stat.ME,stat.ME,https://arxiv.org/pdf/1808.05069v1.pdf
1804.01454v1,2018-04-04T15:05:36Z,2018-04-04 15:05:36,Beta regression control chart for monitoring fractions and proportions,"Regression control charts are usually used to monitor variables of interest that are related to control variables. However, for fraction and/or proportion data, the use of standard regression control charts may not be adequate, since the linear regression model assumes the normality of the interest variable. To work around this problem, we propose the beta regression control chart (BRCC). The BRCC is useful for monitoring fraction, rate and/or proportion data sets when they are related to control variables. The proposed control chart assumes that the mean and dispersion parameters of beta distributed variables are related to the exogenous variables, being modeled using regression structures. The BRCC is numerically assessed through an extensive Monte Carlo simulation study, showing good performance in terms of average run length (ARL). Two applications to real data are presented, evidencing the practical applicability of the proposed method.",Fábio Mariano Bayer|Catia Michele Tondolo|Fernanda Maria Müller,,https://arxiv.org/abs/1804.01454v1,https://arxiv.org/pdf/1804.01454v1,,Accepted paper,"Computers \& Industrial Engineering, 2018",,stat.ME,stat.ME,https://arxiv.org/pdf/1804.01454v1.pdf
1804.00760v2,2018-04-02T23:28:08Z,2019-05-05 20:01:05,Process Control with Highly Left Censored Data,"The need to monitor industrial processes, detecting changes in process parameters in order to promptly correct problems that may arise, generates a particular area of interest. This is particularly critical and complex when the measured value falls below the sensitivity limits of the measuring system or below detection limits, causing much of their observations are incomplete. Such observations to be called incomplete observations or left censored data. With a high level of censorship, for example greater than 70%, the application of traditional methods for monitoring processes is not appropriate. It is required to use appropriate data analysis statistical techniques, to assess the actual state of the process at any time. This paper proposes a way to estimate process parameters in such cases and presents the corresponding control chart, from an algorithm that is also presented.",Javier Neira Rueda|Andres Carrion Garcia,,https://arxiv.org/abs/1804.00760v2,https://arxiv.org/pdf/1804.00760v2,,14 pages,,,stat.AP,stat.AP,https://arxiv.org/pdf/1804.00760v2.pdf
1804.00482v1,2018-04-02T13:31:11Z,2018-04-02 13:31:11,Real Time Sentiment Change Detection of Twitter Data Streams,"In the past few years, there has been a huge growth in Twitter sentiment analysis having already provided a fair amount of research on sentiment detection of public opinion among Twitter users. Given the fact that Twitter messages are generated constantly with dizzying rates, a huge volume of streaming data is created, thus there is an imperative need for accurate methods for knowledge discovery and mining of this information. Although there exists a plethora of twitter sentiment analysis methods in the recent literature, the researchers have shifted to real-time sentiment identification on twitter streaming data, as expected. A major challenge is to deal with the Big Data challenges arising in Twitter streaming applications concerning both Volume and Velocity. Under this perspective, in this paper, a methodological approach based on open source tools is provided for real-time detection of changes in sentiment that is ultra efficient with respect to both memory consumption and computational cost. This is achieved by iteratively collecting tweets in real time and discarding them immediately after their process. For this purpose, we employ the Lexicon approach for sentiment characterizations, while change detection is achieved through appropriate control charts that do not require historical information. We believe that the proposed methodology provides the trigger for a potential large-scale monitoring of threads in an attempt to discover fake news spread or propaganda efforts in their early stages. Our experimental real-time analysis based on a recent hashtag provides evidence that the proposed approach can detect meaningful sentiment changes across a hashtags lifetime.",Sotiris K. Tasoulis|Aristidis G. Vrahatis|Spiros V. Georgakopoulos|Vassilis P. Plagianakos,,https://arxiv.org/abs/1804.00482v1,https://arxiv.org/pdf/1804.00482v1,https://doi.org/10.1109/INISTA.2018.8466326,,,10.1109/INISTA.2018.8466326,cs.CL,cs.CL,https://arxiv.org/pdf/1804.00482v1.pdf
1801.06532v2,2018-01-19T18:52:52Z,2025-11-17 19:25:28,Distribution-Free Control Charts Based on Runs and Patterns,"We propose distribution-free runs-based control charts for detecting location shifts. Using the fact that given the number of total successes, the outcomes of a sequence of Bernoulli trials are random permutations, we are able to control the conditional probability of a signal detected at current time given that there is not alarm before at a pre-determined level. This leads to a desired in-control average run length and data-dependent control limits. Two common runs statistics, the longest run statistic and the scan statitsic, are studied in detail and their exact conditional distributions given the number of total successes are obtained using the finite Markov chain imbedding technique. Numerical results are given to evaluate the performance of the proposed control charts.",Tung-Lung Wu,,https://arxiv.org/abs/1801.06532v2,https://arxiv.org/pdf/1801.06532v2,,,,,stat.ME,stat.ME,https://arxiv.org/pdf/1801.06532v2.pdf
1801.01660v1,2018-01-05T08:04:48Z,2018-01-05 08:04:48,Control charts in a multi product environment: An application study,"In this article an SPC case study is presented. It consists of monitoring a manufacturing process used for different products of similar kind. So far, each of these products is monitored individually. However, if there is e.g. a quality problem with one joint component, this signal will be distributed over different control charts. Therefor a standardization is introduced, similar to short run SPC methods. Then control chart methods are applied to detect process deviations. If there are observations out of control, a next step is taken and process information are analysed in order to derive possible root causes.",Thomas Muehlenstaedt,,https://arxiv.org/abs/1801.01660v1,https://arxiv.org/pdf/1801.01660v1,,,,,stat.AP,stat.AP,https://arxiv.org/pdf/1801.01660v1.pdf
1712.05072v1,2017-12-14T02:11:14Z,2017-12-14 02:11:14,Nonparametric Adaptive CUSUM Chart for Detecting Arbitrary Distributional Changes,"Nonparametric control charts that can detect arbitrary distributional changes are highly desirable due to their flexibility to adapt to different distributional assumptions and distributional changes. However, most of such control charts in the literature either involve some tuning parameter, which needs to be pre-specified, or involve intensive computation. In this paper, we propose a new nonparametric adaptive CUSUM chart for detecting arbitrary distributional changes. The proposed control chart does not depend on any tuning parameter and is efficient in computation. Its self-starting nature makes the proposed control chart applicable to situations where no sufficiently large reference data are available. Our proposed control chart also has a built-in post-signal diagnostics function that can identify what kind of distributional changes have occurred after an alarm. Our simulation study and real data analysis show that the proposed control chart performs well across a broad range of settings, and compares favorably with existing nonparametric control charts.",Jun Li,,https://arxiv.org/abs/1712.05072v1,https://arxiv.org/pdf/1712.05072v1,,,,,stat.ME,stat.ME,https://arxiv.org/pdf/1712.05072v1.pdf
1712.02860v2,2017-12-07T21:10:27Z,2017-12-18 13:22:34,Remarks on Bayesian Control Charts,"There is a considerable amount of ongoing research on the use of Bayesian control charts for detecting a shift from a good quality distribution to a bad quality distribution in univariate and multivariate processes. It is widely claimed that Bayesian control charts are economically optimal; see, for example, Calabrese (1995) [Bayesian process control for attributes. Management Science, DOI: 10.1287/mnsc.41.4.637] and Makis (2008) [Multivariate Bayesian control chart. Operations Research, DOI: 10.1287/opre.1070.0495]. Some researchers also generalize the optimality of controls defined based on posterior probabilities to the class of partially observable Markov decision processes. This note points out that the existing Bayesian control charts cannot generally be optimal because many years ago an analytical counterexample was provided by Taylor (1965) [Markovian sequential replacement processes. The Annals of Mathematical Statistics, DOI: 10.1214/aoms/1177699796].",Amir Ahmadi-Javid|Mohsen Ebadi,,https://arxiv.org/abs/1712.02860v2,https://arxiv.org/pdf/1712.02860v2,,,,,stat.AP,stat.AP|cs.CE|econ.GN|math.OC|math.PR,https://arxiv.org/pdf/1712.02860v2.pdf
1711.04441v1,2017-11-13T06:58:07Z,2017-11-13 06:58:07,Change Detection in a Dynamic Stream of Attributed Networks,"While anomaly detection in static networks has been extensively studied, only recently, researchers have focused on dynamic networks. This trend is mainly due to the capacity of dynamic networks in representing complex physical, biological, cyber, and social systems. This paper proposes a new methodology for modeling and monitoring of dynamic attributed networks for quick detection of temporal changes in network structures. In this methodology, the generalized linear model (GLM) is used to model static attributed networks. This model is then combined with a state transition equation to capture the dynamic behavior of the system. Extended Kalman filter (EKF) is used as an online, recursive inference procedure to predict and update network parameters over time. In order to detect changes in the underlying mechanism of edge formation, prediction residuals are monitored through an Exponentially Weighted Moving Average (EWMA) control chart. The proposed modeling and monitoring procedure is examined through simulations for attributed binary and weighted networks. The email communication data from the Enron corporation is used as a case study to show how the method can be applied in real-world problems.",Mostafa Reisi Gahrooei|Kamran Paynabar,,https://arxiv.org/abs/1711.04441v1,https://arxiv.org/pdf/1711.04441v1,,,,,stat.ME,stat.ME,https://arxiv.org/pdf/1711.04441v1.pdf
