id,submitted,updated,title,abstract,authors,affiliations,link_abstract,link_pdf,link_doi,comment,journal_ref,doi,primary_category,categories,pdf_url
2404.05282v1,2024-04-08T08:16:35Z,2024-04-08 08:16:35,Prediction intervals for overdispersed Poisson data and their application in medical and pre-clinical quality control,"In pre-clinical and medical quality control, it is of interest to assess the stability of the process under monitoring or to validate a current observation using historical control data. Classically, this is done by the application of historical control limits (HCL) graphically displayed in control charts. In many applications, HCL are applied to count data, e.g. the number of revertant colonies (Ames assay) or the number of relapses per multiple sclerosis patient. Count data may be overdispersed, can be heavily right-skewed and clusters may differ in cluster size or other baseline quantities (e.g. number of petri dishes per control group or different length of monitoring times per patient).
  Based on the quasi-Poisson assumption or the negative-binomial distribution, we propose prediction intervals for overdispersed count data to be used as HCL. Variable baseline quantities are accounted for by offsets. Furthermore, we provide a bootstrap calibration algorithm that accounts for the skewed distribution and achieves equal tail probabilities.
  Comprehensive Monte-Carlo simulations assessing the coverage probabilities of eight different methods for HCL calculation reveal, that the bootstrap calibrated prediction intervals control the type-1-error best. Heuristics traditionally used in control charts (e.g. the limits in Sheward c- or u-charts or the mean plus minus 2 SD) fail to control a pre-specified coverage probability.
  The application of HCL is demonstrated based on data from the Ames assay and for numbers of relapses of multiple sclerosis patients. The proposed prediction intervals and the algorithm for bootstrap calibration are publicly available via the R package predint.",Max Menssen|Martina Dammann|Firas Fneish|David Ellenberger|Frank Schaarschmid,,https://arxiv.org/abs/2404.05282v1,https://arxiv.org/pdf/2404.05282v1,,,,,stat.AP,stat.AP,https://arxiv.org/pdf/2404.05282v1.pdf
2403.09138v1,2024-03-14T07:27:26Z,2024-03-14 07:27:26,"Study on Standardizing Working Time: A Case of XYZ Retail Store in Bandung, Indonesia","Work time standardization helps to find and reduce wasteful movements and time in the workplace, such as chatting, mobile phone use, insufficient rest, or unproductive tasks. This study aims to map the process of displaying products from the warehouse to the shelves and calculate and determine the standard working time of employees of the Operations Division of PT XYZ Branch who oversee displaying X Milk and Y Bread. The data was collected six times in three weeks, including interviews and observations, and took a sample of 20 pieces on each product to carry out data analysis such as data sufficiency tests and control charts. Several time deviations were found in the display process of X Milk products on all observation days in different activities. Whereas in the process of displaying Y Bread, only the deviation of working time was found on the 4th observation day, which proves that the process needs to have a standard working time so that the activity work time is more controlled. Therefore, the analysis is carried out with the calculation of performance rating, time allowance, normal time, and standard time. The result of the standard time calculation for the display process of X Milk products is 15.83 minutes and Y Bread is 9.18 minutes for each product of 20 units.",Aprodhita Anindya Putri|Akhmad Yunani,,https://arxiv.org/abs/2403.09138v1,https://arxiv.org/pdf/2403.09138v1,,"9 pages, 11 tables, and 3 figures","International Research Journal of Economics and Management Studies, Vol. 3, No. 2, pp. 86-94, 2024",,econ.GN,econ.GN,https://arxiv.org/pdf/2403.09138v1.pdf
2403.03837v2,2024-03-06T16:28:31Z,2024-10-26 11:31:55,An Adaptive Multivariate Functional EWMA Control Chart,"In many modern industrial scenarios, the measurements of the quality characteristics of interest are often required to be represented as functional data or profiles. This motivates the growing interest in extending traditional univariate statistical process monitoring (SPM) schemes to the functional data setting. This article proposes a new SPM scheme, which is referred to as adaptive multivariate functional EWMA (AMFEWMA), to extend the well-known exponentially weighted moving average (EWMA) control chart from the univariate scalar to the multivariate functional setting. The favorable performance of the AMFEWMA control chart over existing methods is assessed via an extensive Monte Carlo simulation. Its practical applicability is demonstrated through a case study in the monitoring of the quality of a resistance spot welding process in the automotive industry through the online observations of dynamic resistance curves, which are associated with multiple spot welds on the same car body and recognized as the full technological signature of the process.",Christian Capezza|Giovanna Capizzi|Fabio Centofanti|Antonio Lepore|Biagio Palumbo,,https://arxiv.org/abs/2403.03837v2,https://arxiv.org/pdf/2403.03837v2,,,,,stat.ME,stat.ME|stat.AP,https://arxiv.org/pdf/2403.03837v2.pdf
2401.11789v1,2024-01-22T09:40:51Z,2024-01-22 09:40:51,Stein EWMA Control Charts for Count Processes,"The monitoring of serially independent or autocorrelated count processes is considered, having a Poisson or (negative) binomial marginal distribution under in-control conditions. Utilizing the corresponding Stein identities, exponentially weighted moving-average (EWMA) control charts are constructed, which can be flexibly adapted to uncover zero inflation, over- or underdispersion. The proposed Stein EWMA charts' performance is investigated by simulations, and their usefulness is demonstrated by a real-world data example from health surveillance.",Christian H. Weiß,,https://arxiv.org/abs/2401.11789v1,https://arxiv.org/pdf/2401.11789v1,,,,,stat.ME,stat.ME,https://arxiv.org/pdf/2401.11789v1.pdf
2401.10605v1,2024-01-19T10:23:14Z,2024-01-19 10:23:14,The Unconditional Performance of Control Charts for Zero-Inflated Processes with Estimated Parameters,"Control charts for zero-inflated processes have attracted the interest of the researchers in the recent years. In this work we investigate the performance of Shewhart-type charts for zero-inflated Poisson and zero-inflated Binomial processes, in the case of estimated parameters. This is a case that usually occurs in practice, especially prior to starting the process monitoring. Using Monte Carlo simulation we evaluate charts' performance under an unconditional perspective and provide guidelines for their use in practice. We examine both the in-control and the out-of-control performance.",Athanasios C. Rakitzis|Eftychia Mamzeridou|Petros E. Maravelakis,,https://arxiv.org/abs/2401.10605v1,https://arxiv.org/pdf/2401.10605v1,,21 pages,,,stat.AP,stat.AP,https://arxiv.org/pdf/2401.10605v1.pdf
2312.16357v1,2023-12-26T23:50:52Z,2023-12-26 23:50:52,Statistical monitoring of European cross-border physical electricity flows using novel temporal edge network processes,"Conventional modelling of networks evolving in time focuses on capturing variations in the network structure. However, the network might be static from the origin or experience only deterministic, regulated changes in its structure, providing either a physical infrastructure or a specified connection arrangement for some other processes. Thus, to detect change in its exploitation, we need to focus on the processes happening on the network. In this work, we present the concept of monitoring random Temporal Edge Network (TEN) processes that take place on the edges of a graph having a fixed structure. Our framework is based on the Generalized Network Autoregressive statistical models with time-dependent exogenous variables (GNARX models) and Cumulative Sum (CUSUM) control charts. To demonstrate its effective detection of various types of change, we conduct a simulation study and monitor the real-world data of cross-border physical electricity flows in Europe.",Anna Malinovskaya|Rebecca Killick|Kathryn Leeming|Philipp Otto,,https://arxiv.org/abs/2312.16357v1,https://arxiv.org/pdf/2312.16357v1,,,,,stat.AP,stat.AP|stat.ME,https://arxiv.org/pdf/2312.16357v1.pdf
2311.11050v1,2023-11-18T12:15:58Z,2023-11-18 12:15:58,Functional Neural Network Control Chart,"In many Industry 4.0 data analytics applications, quality characteristic data acquired from manufacturing processes are better modeled as functions, often referred to as profiles. In practice, there are situations where a scalar quality characteristic, referred to also as the response, is influenced by one or more variables in the form of functional data, referred to as functional covariates. To adjust the monitoring of the scalar response by the effect of this additional information, a new profile monitoring strategy is proposed on the residuals obtained from the functional neural network, which is able to learn a possibly nonlinear relationship between the scalar response and the functional covariates. An extensive Monte Carlo simulation study is performed to assess the performance of the proposed method with respect to other control charts that appeared in the literature before. Finally, a case study in the railway industry is presented with the aim of monitoring the heating, ventilation and air conditioning systems installed onboard passenger trains.",Murat Kulahci|Antonio Lepore|Biagio Palumbo|Gianluca Sposito,,https://arxiv.org/abs/2311.11050v1,https://arxiv.org/pdf/2311.11050v1,,,,,stat.ME,stat.ME|stat.AP,https://arxiv.org/pdf/2311.11050v1.pdf
2311.02411v1,2023-11-04T14:22:19Z,2023-11-04 14:22:19,A Directional Monitoring Approach of Sequential Incomplete Wind Power Curves with Copula-based Variational Inference,"Wind turbines often work under complex conditions which result in performance degradation. Accurate performance degradation monitoring is essential to ensure the reliable operation of wind turbines and reduce the maintenance costs. Wind turbine power curve monitoring is an effective way to detect performance degradation. However, due to the intermittency and fluctuation of wind speed, the wind speed range varies at different time periods, making power curves difficult to compare. Motivated by this, we proposed copula-based variational inference framework and used it to establish a sequential incomplete wind power curve estimation algorithm. First, a monotone power curve is constructed based on copula-based variational inference and integrated spline regression model. Besides, the prior distribution of model parameters are sequentially updated. Then, a directional control chart based on a new statistic named KLdivergence factor is constructed to monitor wind turbine performance degradation. The real data of a wind farm in the east of the United Kingdom shows that the proposed method can both improve the accuracy of wind turbine power curve modeling and monitor wind turbine performance degradation more precisely and comprehensively than the existing approaches.",Peng Wang|Yanting Li|Fugee Tsung,,https://arxiv.org/abs/2311.02411v1,https://arxiv.org/pdf/2311.02411v1,,,,,stat.AP,stat.AP,https://arxiv.org/pdf/2311.02411v1.pdf
2310.12876v2,2023-10-19T16:30:39Z,2024-04-10 19:15:44,Statistical Process Monitoring of Isolated and Persistent Defects in Complex Geometrical Shapes,"Traditional Statistical Process Control methodologies face several challenges when monitoring defects in complex geometries, such as those of products obtained via Additive Manufacturing techniques. Many approaches cannot be applied in these settings due to the high dimensionality of the data and the lack of parametric and distributional assumptions on the object shapes. Motivated by a case study involving the monitoring of egg-shaped trabecular structures, we investigate two recently-proposed methodologies to detect deviations from the nominal IC model caused by excess or lack of material. Our study focuses on the detection of both isolated large changes in the geometric structure, as well as persistent small deviations. We compare the approach of Scimone et al. (2022) with Zhao and del Castillo (2021) for monitoring defects in a small Phase I sample of 3D-printed objects. While the former control chart is able to detect large defects, the latter allows the detection of nonconforming objects with persistent small defects. Furthermore, we address the fundamental issue of selecting the number of eigenvalues to be monitored in Zhao and del Castillo's method by proposing a dimensionality reduction technique based on kernel principal components. This approach is shown to provide a good detection capability even when considering a large number of eigenvalues. By leveraging the sensitivity of the two monitoring schemes to different magnitudes of nonconformities, we also propose a novel joint monitoring scheme that is capable of identifying both types of defects in the considered case study. Computer code in R and Matlab that implements these methods and replicates the results is available as part of the supplementary material.",Sara Bonacina|Daniele Zago|Giovanna Capizzi|Bianca Maria Colosimo,,https://arxiv.org/abs/2310.12876v2,https://arxiv.org/pdf/2310.12876v2,,"We identified some issues in applying the LB method to the data in the study, which impacted the accuracy and reliability of the results. We sincerely thank Professor Enrique del Castillo and Yulin An for their valuable comments and insights, which helped identifying these issues. We appreciate their contributions and are currently in the process of revising and improving the manuscript",,,stat.AP,stat.AP,https://arxiv.org/pdf/2310.12876v2.pdf
2309.11776v1,2023-09-21T04:36:52Z,2023-09-21 04:36:52,Control Chart for Generalized Weibull Quantiles under Hybrid Censoring,"In this article, bootstrap and Shewhart type process control monitoring schemes are proposed for the quantiles of generalized Weibull distribution under hybrid censoring. Monitoring schemes for the quantiles of Weibull, generalized exponential, Rayleigh, and Burr type $X$ distributions for type I, type II and hybrid censoring can be obtained as the special cases of the proposed schemes. The maximum likelihood estimators are derived under hybrid censoring using EM algorithm and the asymptotic properties of the estimators are discussed in order to develop the Shewhart type scheme. The in-control performance of the schemes is examined in a simulation study on the basis of the average run length for different choices of quantiles, false-alarm rates and sample sizes. Behavior of the out-of-control performance of the schemes is studied for several choices of shifts in the parameters of the chosen density function. The proposed monitoring schemes are illustrated with an example from healthcare and compared with similar schemes under type I and type II censoring. The schemes are found to detect out-of-control signals effectively in terms of frequency and speed both.",Amarjit Kundu|Shovan Chowdhury|Bidhan Modok,,https://arxiv.org/abs/2309.11776v1,https://arxiv.org/pdf/2309.11776v1,,"22 pages, 12 figures",,,stat.ME,stat.ME,https://arxiv.org/pdf/2309.11776v1.pdf
2309.01978v1,2023-09-05T06:13:09Z,2023-09-05 06:13:09,An LSTM-Based Predictive Monitoring Method for Data with Time-varying Variability,"The recurrent neural network and its variants have shown great success in processing sequences in recent years. However, this deep neural network has not aroused much attention in anomaly detection through predictively process monitoring. Furthermore, the traditional statistic models work on assumptions and hypothesis tests, while neural network (NN) models do not need that many assumptions. This flexibility enables NN models to work efficiently on data with time-varying variability, a common inherent aspect of data in practice. This paper explores the ability of the recurrent neural network structure to monitor processes and proposes a control chart based on long short-term memory (LSTM) prediction intervals for data with time-varying variability. The simulation studies provide empirical evidence that the proposed model outperforms other NN-based predictive monitoring methods for mean shift detection. The proposed method is also applied to time series sensor data, which confirms that the proposed method is an effective technique for detecting abnormalities.",Jiaqi Qiu|Yu Lin|Inez Zwetsloot,,https://arxiv.org/abs/2309.01978v1,https://arxiv.org/pdf/2309.01978v1,,"19 pages, 9 figures, 6 tables",,,cs.LG,cs.LG|stat.ME,https://arxiv.org/pdf/2309.01978v1.pdf
2308.11724v2,2023-08-22T18:30:53Z,2023-09-05 04:03:48,MolSieve: A Progressive Visual Analytics System for Molecular Dynamics Simulations,"Molecular Dynamics (MD) simulations are ubiquitous in cutting-edge physio-chemical research. They provide critical insights into how a physical system evolves over time given a model of interatomic interactions. Understanding a system's evolution is key to selecting the best candidates for new drugs, materials for manufacturing, and countless other practical applications. With today's technology, these simulations can encompass millions of unit transitions between discrete molecular structures, spanning up to several milliseconds of real time. Attempting to perform a brute-force analysis with data-sets of this size is not only computationally impractical, but would not shed light on the physically-relevant features of the data. Moreover, there is a need to analyze simulation ensembles in order to compare similar processes in differing environments. These problems call for an approach that is analytically transparent, computationally efficient, and flexible enough to handle the variety found in materials based research. In order to address these problems, we introduce MolSieve, a progressive visual analytics system that enables the comparison of multiple long-duration simulations. Using MolSieve, analysts are able to quickly identify and compare regions of interest within immense simulations through its combination of control charts, data-reduction techniques, and highly informative visual components. A simple programming interface is provided which allows experts to fit MolSieve to their needs. To demonstrate the efficacy of our approach, we present two case studies of MolSieve and report on findings from domain collaborators.",Rostyslav Hnatyshyn|Jieqiong Zhao|Danny Perez|James Ahrens|Ross Maciejewski,,https://arxiv.org/abs/2308.11724v2,https://arxiv.org/pdf/2308.11724v2,,Updated references to GPCCA,,,physics.comp-ph,physics.comp-ph|cs.GR|cs.HC,https://arxiv.org/pdf/2308.11724v2.pdf
2307.10509v1,2023-07-20T00:18:38Z,2023-07-20 00:18:38,An Iterative Wavelet Threshold for Signal Denoising,"This paper introduces an adaptive filtering process based on shrinking wavelet coefficients from the corresponding signal wavelet representation. The filtering procedure considers a threshold method determined by an iterative algorithm inspired by the control charts application, which is a tool of the statistical process control (SPC). The proposed method, called SpcShrink, is able to discriminate wavelet coefficients that significantly represent the signal of interest. The SpcShrink is algorithmically presented and numerically evaluated according to Monte Carlo simulations. Two empirical applications to real biomedical data filtering are also included and discussed. The SpcShrink shows superior performance when compared with competing algorithms.",F. M. Bayer|A. J. Kozakevicius|R. J. Cintra,,https://arxiv.org/abs/2307.10509v1,https://arxiv.org/pdf/2307.10509v1,https://doi.org/10.1016/j.sigpro.2019.04.005,"19 pages, 10 figures, 2 tables","Signal Processing, Volume 162, September 2019, Pages 10-20",10.1016/j.sigpro.2019.04.005,stat.ME,stat.ME|eess.SP|math.NA|math.ST|physics.data-an,https://arxiv.org/pdf/2307.10509v1.pdf
2305.19006v1,2023-05-30T13:03:52Z,2023-05-30 13:03:52,Control Charts for Poisson Counts based on the Stein-Chen Identity,"If monitoring Poisson count data for a possible mean shift (while the Poisson distribution is preserved), then the ordinary Poisson exponentially weighted moving-average (EWMA) control chart proved to be a good solution. In practice, however, mean shifts might occur in combination with further changes in the distribution family. Or due to a misspecification during Phase-I analysis, the Poisson assumption might not be appropriate at all. In such cases, the ordinary EWMA chart might not perform satisfactorily. Therefore, two novel classes of generalized EWMA charts are proposed, which utilize the so-called Stein-Chen identity and are thus sensitive to further distributional changes than just sole mean shifts. Their average run length (ARL) performance is investigated with simulations, where it becomes clear that especially the class of so-called ""ABC-EWMA charts"" shows an appealing ARL performance. The practical application of the novel Stein-Chen EWMA charts is illustrated with an application to count data from semiconductor manufacturing.",Christian H. Weiß,,https://arxiv.org/abs/2305.19006v1,https://arxiv.org/pdf/2305.19006v1,,,,,stat.ME,stat.ME,https://arxiv.org/pdf/2305.19006v1.pdf
2303.04628v1,2023-03-08T14:46:59Z,2023-03-08 14:46:59,An CUSUM Test with Observation-Adjusted Control Limits in Change Detection,"In this paper, we not only propose an new optimal sequential test of sum of logarithmic likelihood ratio (SLR) but also present the CUSUM sequential test (control chart, stopping time) with the observation-adjusted control limits (CUSUM-OAL) for monitoring quickly and adaptively the change in distribution of a sequential observations. Two limiting relationships between the optimal test and a series of the CUSUM-OAL tests are established. Moreover, we give the estimation of the in-control and the out-of-control average run lengths (ARLs) of the CUSUM-OAL test. The theoretical results are illustrated by numerical simulations in detecting mean shifts of the observations sequence.",Fuquan Tang|Dong Han,,https://arxiv.org/abs/2303.04628v1,https://arxiv.org/pdf/2303.04628v1,,,,,stat.AP,stat.AP,https://arxiv.org/pdf/2303.04628v1.pdf
2302.07658v2,2023-02-15T13:43:25Z,2024-06-18 12:36:40,SUrvival Control Chart EStimation Software in R: the success package,"Monitoring the quality of statistical processes has been of great importance, mostly in industrial applications. Control charts are widely used for this purpose, but often lack the possibility to monitor survival outcomes. Recently, inspecting survival outcomes has become of interest, especially in medical settings where outcomes often depend on risk factors of patients. For this reason many new survival control charts have been devised and existing ones have been extended to incorporate survival outcomes. The R package success allows users to construct risk-adjusted control charts for survival data. Functions to determine control chart parameters are included, which can be used even without expert knowledge on the subject of control charts. The package allows to create static as well as interactive charts, which are built using ggplot2 (Wickham 2016) and plotly (Sievert 2020).",Daniel Gomon|Marta Fiocco|Hein Putter|Mirko Signorelli,,https://arxiv.org/abs/2302.07658v2,https://arxiv.org/pdf/2302.07658v2,,"29 pages, 10 figures, guide for the R package success, see https://cran.r-project.org/package=success Published version of the article",,,stat.AP,stat.AP|stat.ME,https://arxiv.org/pdf/2302.07658v2.pdf
2212.10731v1,2022-12-21T02:59:05Z,2022-12-21 02:59:05,Development of robust X-bar charts with unequal sample sizes,"The traditional variable control charts, such as the X-bar chart, are widely used to monitor variation in a process. They have been shown to perform well for monitoring processes under the general assumptions that the observations are normally distributed without data contamination and that the sample sizes from the process are all equal. However, these two assumptions may not be met and satisfied in many practical applications and thus make them potentially limited for widespread application especially in production processes. In this paper, we alleviate this limitation by providing a novel method for constructing the robust X-bar control charts, which can simultaneously deal with both data contamination and unequal sample sizes. The proposed method for the process parameters is optimal in a sense of the best linear unbiased estimation. Numerical results from extensive Monte Carlo simulations and a real data analysis reveal that traditional control charts seriously underperform for monitoring process in the presence of data contamination and are extremely sensitive to even a single contaminated value, while the proposed robust control charts outperform in a manner that is comparable with the traditional ones, whereas they are far superior when the data are contaminated by outliers.",Chanseok Park|Linhan Ouyang|Min Wang,,https://arxiv.org/abs/2212.10731v1,https://arxiv.org/pdf/2212.10731v1,,"27 pages, 10 figures",,,stat.ME,stat.ME,https://arxiv.org/pdf/2212.10731v1.pdf
